<?xml version="1.0" encoding="UTF-8"?>
<!--Sample XML file generated by XMLSpy v2015 rel. 4 (x64) (http://www.altova.com)-->
<GetClientByNDGResponse xmlns="http://unicredit.eu/xmlns/V1/anagrafe" xmlns:xsi="http://www.w3.org/2001/XMLSchema-instance" xsi:schemaLocation="http://unicredit.eu/xmlns/V1/anagrafe clientinfo.xsd">
	<client>
		<ndg>String</ndg>
		<salutation>String</salutation>
		<lang>String</lang>
		<firstName>String</firstName>
		<lastName>String</lastName>
		<birthDate>1957-08-13</birthDate>
		<preferedCategories>
			<category>String</category>
			<category>String</category>
		</preferedCategories>
	</client>
</GetClientByNDGResponse>
